scrappedUrl	eventname	startdate	enddate	timing	eventinfo	ticketlist	orgProfile	orgName	orgWeb	logo	sponsor	agendalist	type	category	city	country	venue	event_website	googlePlaceUrl	ContactMail	Speakerlist	online_event
https://www.ox.ac.uk/event/decolonising-africa-europe-relations	Decolonising Africa-Europe relations	2022-06-16	2022-06-16	"[{""type"": ""general"", ""Start_time"": ""05:00PM"", ""end_time"": ""06:15PM"", ""timezone"": """", ""days"": ""all""}]"	Africa and Europe stand at a crossroads.With several key frameworks governing their partnership being changed at fast pace, the stage is set for them to identify, understand, and overcome the self-deceit that has shaped their relations. The two continent’s key actors have an opportunity to reaffirm what was said by the region’s respective leaders in 2017: that their partnership ought to be built on a “spirit of shared ownership, responsibility, reciprocity, respect and mutual accountability and transparency.”A lot of what has happened recently - from aggravating impacts of climate change, the 2008-2009 financial crisis, to the macroeconomic challenges resulting from a pandemic and the consequences of the War in Ukraine – aggravates the marginalisation of Africa, confirming the need for a change of approach. The colonial shadow, still marking negotiators' mind sets in both sides, is trapping them into the past while overlooking the many opportunities of the future.REGISTRATIONThis talk is live in-person and onlineTo register to attend this talk in-person at the Oxford Martin School, please use the registration form here.To watch this talk live online register on crowdcast here.	"[{""type"": ""free"", ""price"": """", ""currency"": """"}]"	Oxford has a distinctive collegiate structure. Students and academics benefit from belonging both to the University, a large, internationally-renowned institution, and to a college or hall, a small, interdisciplinary academic community.	University of Oxford	https://www.ox.ac.uk/						Oxford	UK	Oxford Martin School 34 Broad Street Oxford OX1 3BD	https://www.oxfordmartin.ox.ac.uk/events/decolonising-africa-europe-relations/	https://www.google.com/maps/place/Oxford+Martin+School/@51.754866,-1.254214,15z/data=!4m2!3m1!1s0x0:0xd6898881deea48fe?sa=X&ved=2ahUKEwjQz_idu6z4AhUei_0HHW3ID8EQ_BJ6BAgfEAU			0
https://www.ox.ac.uk/event/oxford-university-science-park-and-innovation-day	The Oxford University Science Park and Innovation Day	2022-06-16	2022-06-16	"[{""type"": ""general"", ""Start_time"": ""09:30AM"", ""end_time"": ""06:30PM"", ""timezone"": """", ""days"": ""all""}]"	Innovation Festival - Begbroke Science Park | University of Oxford	"[{""type"": ""free"", ""price"": """", ""currency"": """"}]"	Oxford has a distinctive collegiate structure. Students and academics benefit from belonging both to the University, a large, internationally-renowned institution, and to a college or hall, a small, interdisciplinary academic community.	University of Oxford	https://www.ox.ac.uk/						Begbroke	United Kingdom	Begbroke Science Park Begbroke Hill Woodstock Road Begbroke OX5 1PF	https://www.begbroke.ox.ac.uk/events/	https://www.google.com/maps/place/University+of+Oxford+Begbroke+Science+Park/@51.8180043,-1.3065388,15z/data=!4m2!3m1!1s0x0:0x48b7a437091f262?sa=X&ved=2ahUKEwjt1-XZu6z4AhUb7rsIHftpBtwQ_BJ6BAgWEAU			0
https://www.ox.ac.uk/event/personalized-law-law-algorithm	Personalized Law / Law by Algorithm	2022-06-16	2022-06-16	"[{""type"": ""general"", ""Start_time"": ""12:30PM"", ""end_time"": ""06:00PM"", ""timezone"": """", ""days"": ""all""}]"	Technological developments such as digitization, Artificial Intelligence (AI) and Blockchain are fundamentally changing law-making, legal practice and legal scholarship.This is the background for two books released in 2021: Personalized Law (OUP) by Omri Ben-Shahar and Ariel Porat, and Law by Algorithm (Mohr Siebeck) by Horst Eidenmüller and Gerhard Wagner.In the present conference by the Oxford Business Law Blog, these publications will be discussed in the context of the question of how algorithms can improve the law.	"[{""type"": ""free"", ""price"": """", ""currency"": """"}]"	Oxford has a distinctive collegiate structure. Students and academics benefit from belonging both to the University, a large, internationally-renowned institution, and to a college or hall, a small, interdisciplinary academic community.	University of Oxford	https://www.ox.ac.uk/						Oxford	UK	St Hugh's College Maplethorpe Hall St Margaret's Rd Oxford Oxford OX2 6LE	https://www.law.ox.ac.uk/events/personalized-law-law-algorithm	https://www.google.com/maps/place/St+Hugh's+College/@51.7674185,-1.262434,15z/data=!4m2!3m1!1s0x0:0x755bf76094eaeb55?sa=X&ved=2ahUKEwjv15rlu6z4AhWigv0HHT1yD9QQ_BJ6BAgiEAU			0
https://www.ox.ac.uk/event/madrid-action-plan-20-years-signpost-implementation	Madrid Action Plan 20 years on: from Signpost to Implementation	2022-06-16	2022-06-16	"[{""type"": ""general"", ""Start_time"": ""02:00PM"", ""end_time"": ""04:00PM"", ""timezone"": """", ""days"": ""all""}]"		"[{""type"": ""free"", ""price"": """", ""currency"": """"}]"	Oxford has a distinctive collegiate structure. Students and academics benefit from belonging both to the University, a large, internationally-renowned institution, and to a college or hall, a small, interdisciplinary academic community.	University of Oxford	https://www.ox.ac.uk/									https://www.ageing.ox.ac.uk/events/view/487				1
https://www.ox.ac.uk/event/michael-dillon-lgbt-lecture-lord-browne-madingley	The Michael Dillon LGBT+ Lecture: Lord Browne of Madingley	2022-06-17	2022-06-17	"[{""type"": ""general"", ""Start_time"": ""05:00PM"", ""end_time"": ""06:30PM"", ""timezone"": """", ""days"": ""all""}]"	St Anne's College, the University of Oxford and GiveOut are delighted to announce that the second Michael Dillon LGBT+ Lecture will be given by Lord Browne of Madingley, the most senior British businessperson to have come out as LGBT+.The lecture will take place on Friday 17 June in the Mary Ogilvie Lecture Theatre in St Anne's College, University of Oxford, from 17:00 and will be followed by a drinks reception.The lecture will be introduced by Helen King QPM, Principal of St Anne's College, and Lord Browne will be in conversation with David Isaac CBE, Provost of Worcester College and formerly Chair of the Equality and Human Rights Commission (2016-2020) and Chair of Stonewall (2003-2012).Registration for the lecture is encouraged but not required for attendance.ABOUT LORD BROWNE OF MADINGLEY:Lord Browne of Madingley is the most senior British businessperson to have come out as LGBT+. He was the Chief Executive of British Petroleum (BP) between 1995 and 2007, where he massively expanded and diversified BP's core business. Nicknamed 'The Sun King' for his management style and taste for luxury, Lord Browne resigned from BP after 41 years when he was outed by tabloid newspapers and a former partner. He has since written and lectured to improve diversity in the corporate world. As well as chairing numerous businesses, research institutions and cultural venues (from the Donmar Warehouse theatre to the Francis Crick Institute) he served as the President of the Royal Society of Engineering from 2006 to 2011. He was knighted in 1988 and granted a peerage in 2001.ABOUT THE MICHAEL DILLON LGBT+ LECTURES:The Michael Dillon LGBT+ Lectures are named in honour of Michael Dillon, an Oxford alumnus who was the first person to undergo hormone treatment and surgery for a transition from female to male. Announced in November 2020 with an online panel event 'LGBT+ Rights in a Time of Pandemic', the Dillon Lectures are given by LGBT+ individuals from professions other than academia who have reached a position of outstanding achievement in their field. The lectures, which happen twice yearly, aim to shape the national and international conversation about LGBT+ issues. The inaugural lecture was given by Maggi Hambling CBE in Michaelmas Term 2021. You can watch the online announcement event for the lectures, which features more information about Michael Dillon and our aims for the series, here.More information about Michael Dillon's life and legacy can be found in 'Michael Dillon: A Biographical Exhibition', curated by the St Anne's College Library, here.The Michael Dillon LGBT+ Lectures are organised in partnership with GiveOut, an award-winning LGBT+ community foundation enabling LGBT+ people and their advocates to give in one place to support LGBT+ activism worldwide. More information about GiveOut can be found on their website, here.	"[{""type"": ""free"", ""price"": """", ""currency"": """"}]"	Oxford has a distinctive collegiate structure. Students and academics benefit from belonging both to the University, a large, internationally-renowned institution, and to a college or hall, a small, interdisciplinary academic community.	University of Oxford	https://www.ox.ac.uk/						Oxford	UK	St Anne's College Woodstock Road Oxford OX2 6HS		https://www.google.com/maps/place/St+Anne's+College/@51.7621852,-1.2625217,15z/data=!4m2!3m1!1s0x0:0xfdd5c994a406480?sa=X&ved=2ahUKEwiLyJjyu6z4AhWd57sIHbJ4D_EQ_BJ6BAgjEAU			0
https://www.ox.ac.uk/event/panel-discussion-josiah-ober-ethics-ai-aristotle	Panel Discussion with Josiah Ober | Ethics in AI with Aristotle	2022-06-17	2022-06-17	"[{""type"": ""general"", ""Start_time"": ""05:00PM"", ""end_time"": ""07:00PM"", ""timezone"": """", ""days"": ""all""}]"	Presented by the Institute for Ethics in AI as part of the Ethics in AI Colloquium series.This event will also be available to watch live online.	"[{""type"": ""free"", ""price"": """", ""currency"": """"}]"	Oxford has a distinctive collegiate structure. Students and academics benefit from belonging both to the University, a large, internationally-renowned institution, and to a college or hall, a small, interdisciplinary academic community.	University of Oxford	https://www.ox.ac.uk/									https://torch.ox.ac.uk/event/ethics-in-ai-colloquium-with-josh-ober-panel-discussion				1
https://www.ox.ac.uk/event/open-public-lecture-maths-vs-covid-19	Open Public Lecture: Maths vs COVID-19	2022-06-17	2022-06-17	"[{""type"": ""general"", ""Start_time"": ""07:00PM"", ""end_time"": ""08:30PM"", ""timezone"": """", ""days"": ""all""}]"	This event aims to introduce epidemiological mathematical modelling to the general public, with special focus on how models have been used to guide policy making during the COVID-19 pandemic.We would appreciate if you could register for the event in advance. It will allow us to confirm attendance numbers and facilities needed.The main part of the event will be three 15-minute talks given by:1. Professor Christl Donnelly CBE FMedSci FRS, Professor of Applied Statistics, Department of Statistics, University of Oxford and Professor of Statistical Epidemiology, MRC Centre for Global Infectious Disease Analysis, Imperial College LondonProfessor Christl Donnelly is a statistician and epidemiologist studying the spread and control of infectious diseases, with a particular interest in outbreaks. Christl has studied Zika virus, Ebola, MERS, influenza, SARS, bovine TB, foot-and-mouth disease, rabies, cholera, dengue, BSE/vCJD, malaria and HIV/AIDS. She is a leading member of the WHO Ebola Response Team (2014-). She was also deputy chair of the Independent Scientific Group on Cattle TB (1998-2007) which designed, oversaw and analysed the Randomised Badger Culling Trial. In addition to epidemiology and disease control, she is interested in conservation and animal welfare. She is a Fellow of the Academy of Medical Sciences and an Honorary Fellow of the Zoological Society of London. In 2002, she won the Franco-British prize for scientific research from the Académie des Sciences in Paris.2. Professor Lisa White, Professor of Modelling and Epidemiology, Big Data Institute, University of Oxford.Professor Lisa White is a mathematical modeller with a focus on global health and policymaking. Her work combines within- and between-host infection models with multi-strain/species modelling to consider the characterisation, emergence and spread of antimicrobial drug resistance and its containment. Her modelling work is participatory, with models for malaria, COVID-19 and other diseases being developed in close collaboration with national control programs, international decision-makers, funders and donors.3. A group of DPhil students with diverse research experience in mathematical modelling for COVID-19 epidemiology.Throughout the talks, an artist will render a dynamic sketch of the unfolding talks, which will be presented at the end of the talks to the audience.After the main event, we will also offer free canapes and wine / soft drinks in the Maths Institute.This event is funded by RAMP Outreach Innovation Awards from the UKRI (grant number: EP/V053507/1), administered by the Newton Institute at the University of Cambridge.	"[{""type"": ""free"", ""price"": """", ""currency"": """"}]"	Oxford has a distinctive collegiate structure. Students and academics benefit from belonging both to the University, a large, internationally-renowned institution, and to a college or hall, a small, interdisciplinary academic community.	University of Oxford	https://www.ox.ac.uk/						Oxford	UK	Mathematical Institute Andrew Wiles Building Woodstock Road Oxford OX2 6GG	https://www.facebook.com/events/1055037611768538	https://www.google.com/maps/place/Mathematical+Institute/@51.7605886,-1.2627675,15z/data=!4m2!3m1!1s0x0:0x14fcdb0deacb3a22?sa=X&ved=2ahUKEwjA_b39u6z4AhXym_0HHcubBvcQ_BJ6BAgiEAU			0
https://www.ox.ac.uk/event/language-teaching-higher-education	Language Teaching in Higher Education	2022-06-17	2022-06-17	"[{""type"": ""general"", ""Start_time"": ""04:45PM"", ""end_time"": ""06:00PM"", ""timezone"": """", ""days"": ""all""}]"	Talk by Prof. Jane Spiro, Q&A, and refreshments - 'Hidden Study Cultures: cultural pragmatics of learning across borders'Everybody is welcome!It's free but please register.Teaching Room 1 (Basement) Oriental Institute, University of OxfordHiroe Kaji & Emine Cakir Language Teachers' Committee Workshop Organisers	"[{""type"": ""free"", ""price"": """", ""currency"": """"}]"	Oxford has a distinctive collegiate structure. Students and academics benefit from belonging both to the University, a large, internationally-renowned institution, and to a college or hall, a small, interdisciplinary academic community.	University of Oxford	https://www.ox.ac.uk/						Oxford	UK	Faculty of Oriental Studies Pusey Ln Oxford OX1 2LE	https://orinst.web.ox.ac.uk/files/projanespiropdf	https://www.google.com/maps/place/Faculty+of+Oriental+Studies/@51.755808,-1.2608913,15z/data=!4m2!3m1!1s0x0:0xca41e2e36b5d55eb?sa=X&ved=2ahUKEwiG786LvKz4AhV-8rsIHbT_BAAQ_BJ6BAghEAU			0
https://www.ox.ac.uk/event/babar-suleman-unfeeling-exhibition-preview-drinks-reception	Babar Suleman: Unfeeling - Exhibition Preview & Drinks Reception	2022-06-18	2022-06-18	"[{""type"": ""general"", ""Start_time"": ""05:30PM"", ""end_time"": ""06:30PM"", ""timezone"": """", ""days"": ""all""}]"	Exhibition Preview & Drinks Reception – Saturday 18 June 2022, 5.30pm-6.30pm The Buttery, all welcomeShot in a military-backed institution in Pakistan, Unfeeling is a portrait of male vulnerability, told through arcs of desire, heartbreak, and defence. The film explores the interplay and shifting states of being between subject and object.Babar Suleman is an artist and writer, reading for a practice-led Doctor of Philosophy in Fine Art at the University of Oxford, and a Senior Lecturer in Filmmaking at the Manchester School of Art. Suleman was an Inclusive Histories Research Fellow at Compton Verney Art Gallery in 2021. Recent commissions and grants include b-side, Platform Art Projects, and Arts Council England.Babar Suleman: Unfeeling | University of OxfordWolfson Events | Wolfson College, Oxford	"[{""type"": ""free"", ""price"": """", ""currency"": """"}]"	Oxford has a distinctive collegiate structure. Students and academics benefit from belonging both to the University, a large, internationally-renowned institution, and to a college or hall, a small, interdisciplinary academic community.	University of Oxford	https://www.ox.ac.uk/						Oxford	UK	Wolfson College Linton Road Oxford OX2 6UD	https://www.wolfson.ox.ac.uk/event/babar-suleman-unfeeling-exhibition-preview-drinks-reception	https://www.google.com/maps/place/Wolfson+College/@51.7710407,-1.2556339,15z/data=!4m2!3m1!1s0x0:0x4e39181df53da749?sa=X&ved=2ahUKEwi0q9iYvKz4AhVTm_0HHRzgBLAQ_BJ6BAgdEAU			0
https://www.ox.ac.uk/event/animal-ethics	Animal Ethics	2022-06-18	2022-06-18	"[{""type"": ""general"", ""Start_time"": ""10:30AM"", ""end_time"": ""04:00PM"", ""timezone"": """", ""days"": ""all""}]"	Animal Ethics is a fun, family-friendly day of craft activities, games and mini-talks about how we treat animals, and the subject of animal ethics.Recommended for kids aged 4-10.Animal Ethics at OUMNH is part of the Oxford Uehiro Centre’s annual Festival of Arguments.	"[{""type"": ""free"", ""price"": """", ""currency"": """"}]"	Oxford has a distinctive collegiate structure. Students and academics benefit from belonging both to the University, a large, internationally-renowned institution, and to a college or hall, a small, interdisciplinary academic community.	University of Oxford	https://www.ox.ac.uk/						Oxford	UK	Museum of Natural History Parks Road Oxford OX1 3PW	https://oumnh.web.ox.ac.uk/event/animal-ethics	https://www.google.com/maps/place/Oxford+University+Museum+of+Natural+History/@51.758703,-1.255467,15z/data=!4m5!3m4!1s0x0:0x2b1bc402e55d6557!8m2!3d51.758703!4d-1.255467			0
https://www.ox.ac.uk/event/my-normal-museum-takeover	'My Normal' Museum Takeover	2022-06-18	2022-06-18	"[{""type"": ""general"", ""Start_time"": ""06:00PM"", ""end_time"": ""08:00PM"", ""timezone"": """", ""days"": ""all""}]"	Join long-time museum partners, community group My Normal, for a night subverting hierarchies in the Museum!Live music, refreshments, zines and general creativity!Ticket link coming soon.	"[{""type"": ""free"", ""price"": """", ""currency"": """"}]"	Oxford has a distinctive collegiate structure. Students and academics benefit from belonging both to the University, a large, internationally-renowned institution, and to a college or hall, a small, interdisciplinary academic community.	University of Oxford	https://www.ox.ac.uk/						Oxford	UK	Pitt Rivers Museum South Parks Road Oxford OX1 3PP	https://www.prm.ox.ac.uk/event/my-normal-museum-takeover	https://www.google.com/maps/place/Pitt+Rivers+Museum/@51.7588148,-1.2551042,15z/data=!4m2!3m1!1s0x0:0xf4c5c643309eedd8?sa=X&ved=2ahUKEwi-tKazvKz4AhVbi_0HHVrSChkQ_BJ6BAhAEAU			0
https://www.ox.ac.uk/event/lise-de-la-salle-sje-arts-international-piano-series	Lise de la Salle - SJE Arts International Piano Series	2022-06-18	2022-06-18	"[{""type"": ""general"", ""Start_time"": ""07:30PM"", ""end_time"": ""09:30PM"", ""timezone"": """", ""days"": ""all""}]"	'When do we dance?'French touch Maurice Ravel: Valses nobles et sentimentales Camille Saint Saëns: Étude en forme de ValseSlavic Soul Béla Bartók: Romanian Folk Dances Alexandre Scriabin: Waltz in A-flat major, Op. 38 Sergei Rachmaninoff arr. Vyacheslav Gryaznov: Italian PolkaIntervalSpanish Influence Manuel de Falla: Danza rituel del fuego Alberto Ginastera: Dansas argentinas Astor Piazzolla: LibertangoAmerican Dream George Gershwin: When do we dance? William Bolcom: Graceful ghost rag Fats Waller: Viper’s drag Art Tatum: Tea for TwoLise de la Salle’s wonderfully exuberant dance programme brings the 2022 SJE Arts International Piano Series to a dazzling close.Lise de la Salle has established herself as one of today’s most exciting young artists and as a musician of real sensibility and maturity. Her playing inspired a Washington Post critic to write: ​'For much of the concert, the audience had to remember to breathe… the exhilaration didn’t let up for a second until her hands came off the keyboard.'	"[{""type"": ""paid"", ""price"": ""30"", ""currency"": ""£""}]"	Oxford has a distinctive collegiate structure. Students and academics benefit from belonging both to the University, a large, internationally-renowned institution, and to a college or hall, a small, interdisciplinary academic community.	University of Oxford	https://www.ox.ac.uk/						Oxford	UK	St John the Evangelist church 109A Iffley Road Oxford OX4 1EH	https://sje-arts.org/event/lise-de-la-salle-when-do-we-dance/	https://www.google.com/maps/place/St+John+the+Evangelist+Church/@51.7461964,-1.2404863,15z/data=!4m2!3m1!1s0x0:0x70dd5ededdf82ae3?sa=X&ved=2ahUKEwjw1oPDvKz4AhWGhf0HHRM7CXcQ_BJ6BAgjEAU			0
https://www.ox.ac.uk/event/concert-ukraine-0	Concert for Ukraine	2022-06-19	2022-06-19	"[{""type"": ""general"", ""Start_time"": ""05:00PM"", ""end_time"": ""07:30PM"", ""timezone"": """", ""days"": ""all""}]"	Wolfson College Music Society presents CONCERT FOR UKRAINE.Performed by Sarkis ZakarianScarlatti Two Sonatas in D minor K213 & K141 Mozart Sonata in C Major KV330 Komitas Dance of Shushiki Babajanian Elegie Haydn Variations in F minor Hob XVII:6 Haydn Sonata in A flat major Hob XVI:46 Chopin Nocturne in C sharp minor Op. Posth. Chopin Scherzo No. 1 in B minor Op. 20Tickets £10 (cash on the door). Further donations welcome. All proceeds from the concert will go to Save the Children Ukraine Humanitarian Appeal.Wolfson Events | Wolfson College, Oxford	"[{""type"": ""paid"", ""price"": ""10"", ""currency"": ""£""}]"	Oxford has a distinctive collegiate structure. Students and academics benefit from belonging both to the University, a large, internationally-renowned institution, and to a college or hall, a small, interdisciplinary academic community.	University of Oxford	https://www.ox.ac.uk/						Oxford	UK	Wolfson College Linton Road Oxford OX2 6UD	https://www.wolfson.ox.ac.uk/event/concert-ukraine	https://www.google.com/maps/place/Wolfson+College/@51.7710407,-1.2556339,15z/data=!4m2!3m1!1s0x0:0x4e39181df53da749?sa=X&ved=2ahUKEwi0q9iYvKz4AhVTm_0HHRzgBLAQ_BJ6BAgdEAU			0
